,Flat Name,Flat address,Configurations,Possession_Starts,Avg. Price,Sizes,Project Area,Project Size,Launch Date,About,images
75,Salarpuria Sattva Aspire,"Near United Public School,Hennur, Chikkagubbi On Hennur Main Road, North Bangalore, Bangalore",3 BHK Apartment,Ready to Move in,5.69 K/sq.ft,1904.00 sq.ft.,2 Acres,3 Buildings - 119 units,"Aug, 2013","Salarpuria Sattva Aspire is a project by Salarpuria Sattva in Bangalore. It is a Ready to Move in project. Salarpuria Sattva Aspire offers some of the most conveniently designed Apartment. Located in Chikkagubbi Village, it is a residential project. The project is spread over 2 Acres . It has 119 units. There are 3 buildings in this project. Salarpuria Sattva Aspire offers some of the most exclusive 3 BHK. As per the area plan, units are in the size of 1904.0 sq.ft.. Launched in September 2013, Salarpuria Sattva Aspire is slated for possession in Dec, 2016. The address of Salarpuria Sattva Aspire is Near United Public School,Hennur, Chikkagubbi On Hennur Main Road.Salarpuria Sattva Aspire ensures a coveted lifestyle and offers a convenient living. It offers facilities such as Gymnasium, Power Backup. If you are a sports lover, there are provisions meant for you such as Cycling & Jogging Track. Young families with kids can explore modern-arrangements for leisure and play such as Children's Play Area, nearby apart from Swimming Pool. There is 24x7 Security. Some other provisions include access to Landscaped Garden, Multipurpose Room, Staff Quarter.All major banks such as HDFC, LIC Housing Finance have approved home loans for Salarpuria Sattva Aspire. You can also avail of Pay 5% now & Move-in today, Limited-time offer.Established in 1986, Salarpuria Sattva is a renowned developer firm. Till date, Salarpuria Sattva has developed 63 projects with a focus on healthy and sustainable lifestyle.Chikkagubbi Village is well-connected to other parts of the city via an extensive road.","['https://is1-2.housingcdn.com/4f2250e8/bfcb9e6ec2f8093fb16e1fc6269513f9/v0/_p/salarpuria_sattva_aspire-hennur_main_road-bengaluru-salarpuria_sattva.jpg', 'https://is1-2.housingcdn.com/4f2250e8/bfcb9e6ec2f8093fb16e1fc6269513f9/v0/large/salarpuria_sattva_aspire-hennur_main_road-bengaluru-salarpuria_sattva.jpg', 'https://img.youtube.com/vi/wbIbO1fWVYk/hqdefault.jpg', 'https://is1-3.housingcdn.com/012c1500/9522a3668ca4bc73b463148820eee355/v0/_p.png']"
76,Salarpuria Sattva Aspire,"Near United Public School,Hennur, Chikkagubbi On Hennur Main Road, North Bangalore, Bangalore",3 BHK Apartment,Ready to Move in,5.69 K/sq.ft,1904.00 sq.ft.,2 Acres,3 Buildings - 119 units,"Aug, 2013","Salarpuria Sattva Aspire is a project by Salarpuria Sattva in Bangalore. It is a Ready to Move in project. Salarpuria Sattva Aspire offers some of the most conveniently designed Apartment. Located in Chikkagubbi Village, it is a residential project. The project is spread over 2 Acres . It has 119 units. There are 3 buildings in this project. Salarpuria Sattva Aspire offers some of the most exclusive 3 BHK. As per the area plan, units are in the size of 1904.0 sq.ft.. Launched in September 2013, Salarpuria Sattva Aspire is slated for possession in Dec, 2016. The address of Salarpuria Sattva Aspire is Near United Public School,Hennur, Chikkagubbi On Hennur Main Road.Salarpuria Sattva Aspire ensures a coveted lifestyle and offers a convenient living. It offers facilities such as Gymnasium, Power Backup. If you are a sports lover, there are provisions meant for you such as Cycling & Jogging Track. Young families with kids can explore modern-arrangements for leisure and play such as Children's Play Area, nearby apart from Swimming Pool. There is 24x7 Security. Some other provisions include access to Landscaped Garden, Multipurpose Room, Staff Quarter.All major banks such as HDFC, LIC Housing Finance have approved home loans for Salarpuria Sattva Aspire. You can also avail of Pay 5% now & Move-in today, Limited-time offer.Established in 1986, Salarpuria Sattva is a renowned developer firm. Till date, Salarpuria Sattva has developed 63 projects with a focus on healthy and sustainable lifestyle.Chikkagubbi Village is well-connected to other parts of the city via an extensive road.","['https://is1-2.housingcdn.com/4f2250e8/bfcb9e6ec2f8093fb16e1fc6269513f9/v0/_p/salarpuria_sattva_aspire-hennur_main_road-bengaluru-salarpuria_sattva.jpg', 'https://is1-2.housingcdn.com/4f2250e8/bfcb9e6ec2f8093fb16e1fc6269513f9/v0/large/salarpuria_sattva_aspire-hennur_main_road-bengaluru-salarpuria_sattva.jpg', 'https://img.youtube.com/vi/wbIbO1fWVYk/hqdefault.jpg', 'https://is1-3.housingcdn.com/012c1500/9522a3668ca4bc73b463148820eee355/v0/_p.png']"
77,Rohan Upavan Phase 4,"Kyalasanahalli Village, Avalahalli Main Road, Near Byrathi Cross, Narayanapura On Hennur Main Road, North Bangalore, Bangalore","1, 1.5, 2, 3 BHK Apartments","Mar, 2026",4.88 K/sq.ft,610.00 sq.ft. - 1830.00 sq.ft.,1 Acres,118 units,"May, 2019","Bangalore based Rohan Builders And Developers have come up with their new residential project Upavan Phase 4. The project is strategically located at Narayanapura bordered by Hennur Main Road. The project is spread over a total of 0.9 acres and will provide the homeowners with 1, 2, and 3BHK apartments which are aesthetically designed with maximum area efficiency. The coverage area of the apartments ranges from 610 to 1830 sq. ft.Narayanapura is bordered by Hennur Main Road on the east and the Narayanapura Cross Road on the west. The place is located close to Kothanur, Defence Enclave, Hanumanthappa Layout, the Indradhanush Layout and Sangam Enclave. The locality offers a comprehensive network of roadways and railways. The City Junction Railway Station is located 19.3 km from Narayanapura and can be reached within 30 minutes via the Outer Ring Road. The HAL International Airport is located at a distance of 16.7 km from the area. BMTC buses serve the area very well. If you wish to turn your dream of owning a home, then do not wait and check out the project site quickly.","['https://is1-2.housingcdn.com/4f2250e8/a046d29b6bfb6d114f2f99d0f6af514e/v0/_p/rohan_upavan_phase_4-hennur_main_road-bengaluru-rohan_builders_i_pvt_ltd.jpeg', 'https://is1-2.housingcdn.com/4f2250e8/a046d29b6bfb6d114f2f99d0f6af514e/v0/large/rohan_upavan_phase_4-hennur_main_road-bengaluru-rohan_builders_i_pvt_ltd.jpeg', 'https://img.youtube.com/vi/2JhEwQK6Wkk/hqdefault.jpg', 'https://is1-3.housingcdn.com/012c1500/17a9e3f17fc84a598cc61e4fbc35ba94/v0/_p.jpeg']"
78,Total Environment In That Quiet Earth Phase 2 A,"Property Katha No. 28 , 46, 110,111 Situated At Budigere Cross, North Bangalore, Bangalore",4 BHK Villa,"Dec, 2025",12.81 K/sq.ft,2768.00 sq.ft.,4.81 Acres,55 units,"Oct, 2020","Looking for Villa in Cheemasandra, Bangalore?. Total Environment In That Quiet Earth Phase 2 A is a project by Total Environment Building Systems. The project is offering 4 BHK. It is set in 4.81 Acres . Total Environment In That Quiet Earth Phase 2 A is a Under Construction residential project. There are 55 units. As per the area plan, units are in the size of 2768.0 sq.ft.. Total Environment In That Quiet Earth Phase 2 A is located in Property Katha No. 28 , 46, 110,111 Situated At Budigere Cross. Total Environment In That Quiet Earth Phase 2 A was launched in October 2020.Total Environment In That Quiet Earth Phase 2 A offers a host of facilities for residents. This includes Power Backup. These amenities in Total Environment In That Quiet Earth Phase 2 A are those that every homebuyer aspires for!.RERA ID is PRM/KA/RERA/1251/446/PR/201001/003630.Total Environment In That Quiet Earth Phase 2 A is RERA-compliant and all necessary approvals are in place.Total Environment Building Systems is a reputed building firm with 35 projects since its inception in 1996.Bileshivale is well-connected to other parts of city by road, which passes through the heart of this suburb.  Prominent shopping malls, movie theatres, school, and hospitals are present in proximity of this residential project.","['https://is1-2.housingcdn.com/012c1500/146d7dd3ae12eb9de1ce7d83efac0e9c/v0/_p/total_environment_in_that_quiet_earth_phase_2_a-cheemasandra-bengaluru-total_environment_building_systems.jpeg', 'https://is1-2.housingcdn.com/012c1500/146d7dd3ae12eb9de1ce7d83efac0e9c/v0/large/total_environment_in_that_quiet_earth_phase_2_a-cheemasandra-bengaluru-total_environment_building_systems.jpeg', 'https://is1-2.housingcdn.com/012c1500/146d7dd3ae12eb9de1ce7d83efac0e9c/v0/_p.jpeg', 'https://is1-3.housingcdn.com/012c1500/731da5ad12157f14ca30a4c9630d5871/v0/_p.jpeg']"
79,Pride Pegasus,"Site No. 20, Sy No. 115/1, Opp. Bible College Hennur Road, Byrathi, Kuvempu Layout On Hennur Main Road, North Bangalore, Bangalore","2, 3 BHK Apartments","Jun, 2023",5.50 K/sq.ft,1197.00 sq.ft. - 1816.00 sq.ft.,2 Acres,2 Buildings - 208 units,"Mar, 2021","Pride Pegasus is a residential project in Hennur Main Road, Bangalore. It is set in an area of 2 Acres . Pride Pegasus offers Apartment. Available configurations include 2 BHK, 3 BHK. Apartment, as per the area plan, are in the size range of 1197.0 - 1816.0 sq.ft.. The property is Under Construction. There are 2 buildings for sale. The project was launched in March 2021 and possession date of Pride Pegasus is Jun, 2023. Pride Pegasus is located in Site No. 20, Sy No. 115/1, Opp. Bible College Hennur Road, Byrathi, Kuvempu Layout On Hennur Main Road. The project is developed by Pride And Expert Properties Private Limited. There are 208 units for sale.Pride Pegasus is equipped with various resident-centric amenities that includes Gymnasium, Power Backup. For families with kids, there is Children's Play Area, nearby apart from Swimming Pool. The property is equipped with Fire Protection And Fire Safety Requirements. There is 24x7 Security. It is a Gated Community. Enjoy a class-apart lifestyle at Pride Pegasus.This project meets all mandates as required by the state authority. RERA ID of Pride Pegasus is RM/KA/RERA/1251/446/PR/210130/003809.Located close to prominent suburbs of Bangalore, the area of Visthar has prominent schools and hospitals within a close distance.","['https://is1-2.housingcdn.com/4f2250e8/e814a452700244e55b2298c850fe4f39/v0/_p/pride_pegasus-hennur_main_road-bengaluru-pride_and_expert_properties_private_limited.jpeg', 'https://is1-2.housingcdn.com/4f2250e8/e814a452700244e55b2298c850fe4f39/v0/large/pride_pegasus-hennur_main_road-bengaluru-pride_and_expert_properties_private_limited.jpeg', 'https://img.youtube.com/vi/UyeMdY9lsgQ/hqdefault.jpg', 'https://is1-3.housingcdn.com/012c1500/6fa4de2e4e98e7b0636b6f44bd1ae457/v0/_p.jpg']"
80,Bhartiya Leela Residences,"32/1, Bhartiya City, Near ICICI Manipal Academy, Near Hebbal,Kannur on Thanisandra Main Road, North Bangalore, Bangalore","Studio, 1, 2, 3, 4 BHK Apartment, Studio Apartments","Sep, 2020",12.50 K/sq.ft,802.00 sq.ft. - 4176.00 sq.ft.,2 Acres,3 Buildings - 176 units,"Oct, 2014","Bhartiya Leela Residences is a residential project by Bhartiya City Developers Pvt Ltd located at Bangalore in Bangalore. The key amenities of the project include Landscaped Garden, Power Backup, Cycling & Jogging Track, Rainwater Harvesting and Indoor Game Room   Billiards/Snooker Table, Carom Board, Table Tennis, Foosball Table. Owing to its location, facilities such as schools, hospitals, ATMs, and markets are available at a close distance from Bhartiya Leela Residences. An extensive network of public transports in the close vicinity makes the project accessible.","['https://is1-2.housingcdn.com/4f2250e8/b3b917c84bcf7e1f2e389e16dc0aa6a0/v7/_p/bhartiya_leela_residences-thanisandra_main_road-bengaluru-bhartiya_city_developers_pvt_ltd.jpg', 'https://is1-2.housingcdn.com/4f2250e8/b3b917c84bcf7e1f2e389e16dc0aa6a0/v7/large/bhartiya_leela_residences-thanisandra_main_road-bengaluru-bhartiya_city_developers_pvt_ltd.jpg', 'https://img.youtube.com/vi/xgX5abujMdg/hqdefault.jpg', 'https://is1-3.housingcdn.com/012c1500/36baa20da01b469885c5d4b9aa736b8e/v0/_p.jpeg']"
81,Total Environment In That Quiet Earth,"Aavalahalli Main Road, Pete Krishnappa Layout, K Channasandra, Near Anagalapura Near Hennur Main Road, North Bangalore, Bangalore","2, 3, 4 BHK Apartments","Dec, 2025",6.95 K/sq.ft,1431.00 sq.ft. - 2890.00 sq.ft.,14.69 Acres,4 Buildings - 560 units,"Nov, 2017",,"['https://is1-3.housingcdn.com/4f2250e8/aa7aa25f2cbe2d3d3f037e8f72108361/v0/_p/total_environment_in_that_quiet_earth-hennur_main_road-bengaluru-total_environment_building_systems.jpg', 'https://is1-3.housingcdn.com/4f2250e8/aa7aa25f2cbe2d3d3f037e8f72108361/v0/large/total_environment_in_that_quiet_earth-hennur_main_road-bengaluru-total_environment_building_systems.jpg', 'https://img.youtube.com/vi/DWKqctHnpBw/hqdefault.jpg', 'https://is1-2.housingcdn.com/012c1500/9208bd228eaa28e42a33fb49e4e3903f/v2/_p.jpg']"
82,Total Environment In That Quiet Earth Phase 2 A,"Property Katha No. 28 , 46, 110,111 Situated At Budigere Cross, North Bangalore, Bangalore",4 BHK Villa,"Dec, 2025",12.81 K/sq.ft,2768.00 sq.ft.,4.81 Acres,55 units,"Oct, 2020","Looking for Villa in Cheemasandra, Bangalore?. Total Environment In That Quiet Earth Phase 2 A is a project by Total Environment Building Systems. The project is offering 4 BHK. It is set in 4.81 Acres . Total Environment In That Quiet Earth Phase 2 A is a Under Construction residential project. There are 55 units. As per the area plan, units are in the size of 2768.0 sq.ft.. Total Environment In That Quiet Earth Phase 2 A is located in Property Katha No. 28 , 46, 110,111 Situated At Budigere Cross. Total Environment In That Quiet Earth Phase 2 A was launched in October 2020.Total Environment In That Quiet Earth Phase 2 A offers a host of facilities for residents. This includes Power Backup. These amenities in Total Environment In That Quiet Earth Phase 2 A are those that every homebuyer aspires for!.RERA ID is PRM/KA/RERA/1251/446/PR/201001/003630.Total Environment In That Quiet Earth Phase 2 A is RERA-compliant and all necessary approvals are in place.Total Environment Building Systems is a reputed building firm with 35 projects since its inception in 1996.Bileshivale is well-connected to other parts of city by road, which passes through the heart of this suburb.  Prominent shopping malls, movie theatres, school, and hospitals are present in proximity of this residential project.","['https://is1-2.housingcdn.com/012c1500/146d7dd3ae12eb9de1ce7d83efac0e9c/v0/_p/total_environment_in_that_quiet_earth_phase_2_a-cheemasandra-bengaluru-total_environment_building_systems.jpeg', 'https://is1-2.housingcdn.com/012c1500/146d7dd3ae12eb9de1ce7d83efac0e9c/v0/large/total_environment_in_that_quiet_earth_phase_2_a-cheemasandra-bengaluru-total_environment_building_systems.jpeg', 'https://is1-2.housingcdn.com/012c1500/146d7dd3ae12eb9de1ce7d83efac0e9c/v0/_p.jpeg', 'https://is1-3.housingcdn.com/012c1500/731da5ad12157f14ca30a4c9630d5871/v0/_p.jpeg']"
83,Shriram Luxor,"Chikkagubbi On Hennur Main Road, North Bangalore, Bangalore","2.5, 3 BHK Apartments","Mar, 2020",6.93 K/sq.ft,1054.00 sq.ft. - 1149.00 sq.ft.,4 Acres,8 Buildings - 444 units,"Oct, 2014","Shriram Luxor is an exclusive edifice that comprises of homes that will leave you truly impressed. The apartments here are designed keeping in mind the needs and demands of a modern dweller. Immerse in the lavishness of this project and lead an enhanced lifestyle you always wished for. Denoting excellence and efficiency in its design and style, Shriram Luxor is an epitome of an ideal dwelling. Cherish spending wonderful moments with your loved ones and experience a lifetime of joy, comforts, peace and privacy the way you always wished for.","['https://is1-3.housingcdn.com/4f2250e8/0e4a955ae40be4364f2744bca109385e/v0/_p/shriram_luxor-hennur_main_road-bengaluru-shriram_properties_limited.jpg', 'https://is1-3.housingcdn.com/4f2250e8/0e4a955ae40be4364f2744bca109385e/v0/large/shriram_luxor-hennur_main_road-bengaluru-shriram_properties_limited.jpg', 'https://img.youtube.com/vi/yf5M-O8NNhg/hqdefault.jpg', 'https://is1-3.housingcdn.com/012c1500/007a17b13338b0f561bac926a90287ab/v0/_p.jpeg']"
84,SOUL & SOIL,"Chikkagubbi On Hennur Main Road, North Bangalore, Bangalore","1, 3, 4 BHK Apartment, Villas","Feb, 2023",Price on request,2128.00 sq.ft.,,94 units,"Jun, 2018","Phase 2 Launched
  Set across seven cozy acres, one of the prime features of this project is a skylight in every home, a simple design detail that instantly connects the resident to the world outside. Apart from which all homes have compact internal courtyards and a host of community spaces.","['https://is1-2.housingcdn.com/4f2250e8/3b90da567e7fed7958bff098749c3ec0/v0/_p/soul__soil-hennur_main_road-bengaluru-assetz_property_group.jpeg', 'https://is1-2.housingcdn.com/4f2250e8/3b90da567e7fed7958bff098749c3ec0/v0/large/soul__soil-hennur_main_road-bengaluru-assetz_property_group.jpeg', 'https://img.youtube.com/vi/0yh46g1RhB0/hqdefault.jpg', 'https://is1-3.housingcdn.com/012c1500/03d62ee4be1e7aad7c82c8f72ea5ef4b/v0/_p.jpeg']"
85,Pride Pegasus,"Site No. 20, Sy No. 115/1, Opp. Bible College Hennur Road, Byrathi, Kuvempu Layout On Hennur Main Road, North Bangalore, Bangalore","2, 3 BHK Apartments","Jun, 2023",5.50 K/sq.ft,1197.00 sq.ft. - 1816.00 sq.ft.,2 Acres,2 Buildings - 208 units,"Mar, 2021","Pride Pegasus is a residential project in Hennur Main Road, Bangalore. It is set in an area of 2 Acres . Pride Pegasus offers Apartment. Available configurations include 2 BHK, 3 BHK. Apartment, as per the area plan, are in the size range of 1197.0 - 1816.0 sq.ft.. The property is Under Construction. There are 2 buildings for sale. The project was launched in March 2021 and possession date of Pride Pegasus is Jun, 2023. Pride Pegasus is located in Site No. 20, Sy No. 115/1, Opp. Bible College Hennur Road, Byrathi, Kuvempu Layout On Hennur Main Road. The project is developed by Pride And Expert Properties Private Limited. There are 208 units for sale.Pride Pegasus is equipped with various resident-centric amenities that includes Gymnasium, Power Backup. For families with kids, there is Children's Play Area, nearby apart from Swimming Pool. The property is equipped with Fire Protection And Fire Safety Requirements. There is 24x7 Security. It is a Gated Community. Enjoy a class-apart lifestyle at Pride Pegasus.This project meets all mandates as required by the state authority. RERA ID of Pride Pegasus is RM/KA/RERA/1251/446/PR/210130/003809.Located close to prominent suburbs of Bangalore, the area of Visthar has prominent schools and hospitals within a close distance.","['https://is1-2.housingcdn.com/4f2250e8/e814a452700244e55b2298c850fe4f39/v0/_p/pride_pegasus-hennur_main_road-bengaluru-pride_and_expert_properties_private_limited.jpeg', 'https://is1-2.housingcdn.com/4f2250e8/e814a452700244e55b2298c850fe4f39/v0/large/pride_pegasus-hennur_main_road-bengaluru-pride_and_expert_properties_private_limited.jpeg', 'https://img.youtube.com/vi/UyeMdY9lsgQ/hqdefault.jpg', 'https://is1-3.housingcdn.com/012c1500/6fa4de2e4e98e7b0636b6f44bd1ae457/v0/_p.jpg']"
86,SOUL & SOIL,"Chikkagubbi On Hennur Main Road, North Bangalore, Bangalore","1, 3, 4 BHK Apartment, Villas","Feb, 2023",Price on request,2128.00 sq.ft.,,94 units,"Jun, 2018","Phase 2 Launched
  Set across seven cozy acres, one of the prime features of this project is a skylight in every home, a simple design detail that instantly connects the resident to the world outside. Apart from which all homes have compact internal courtyards and a host of community spaces.","['https://is1-2.housingcdn.com/4f2250e8/3b90da567e7fed7958bff098749c3ec0/v0/_p/soul__soil-hennur_main_road-bengaluru-assetz_property_group.jpeg', 'https://is1-2.housingcdn.com/4f2250e8/3b90da567e7fed7958bff098749c3ec0/v0/large/soul__soil-hennur_main_road-bengaluru-assetz_property_group.jpeg', 'https://img.youtube.com/vi/0yh46g1RhB0/hqdefault.jpg', 'https://is1-3.housingcdn.com/012c1500/03d62ee4be1e7aad7c82c8f72ea5ef4b/v0/_p.jpeg']"
87,Adarsh Pinecourt,"Sy No. 91, Chikkagubbi On Hennur Main Road, North Bangalore, Bangalore","2, 2.5, 3 BHK Apartments","Aug, 2022",5.00 K/sq.ft,1172.00 sq.ft. - 1822.00 sq.ft.,4 Acres,201 units,"Jan, 2019","Located close to Royal Care Speciality Hospital, Adarsh Pinecourt is an excellent new residential real estate project available for your consideration at Chikkagubbi on Hennur Main Road, Bangalore. Created by Adarsh Developers, the sprawling complex offers you latest conveniences such as a gymnasium and garden for a very reasonable price.Epitomizing the exceptional living experience, it introduces apartments that are replete with all the possible features. This lavish creation is peacefully away from the city nuisance yet close to all the likely services. The vast 2 BHK and 3 BHK apartments with contemporary rooms they are a smart and wonderful blend of abundance and affordability. The flats with spacious and airy rooms are a joy to live in and offer you an fantastic lifestyle. Surrounded by encouraging greenery Adarsh Pinecourt is the ample housing investment for you and a mystic abode for your family. It is perfect as your place to withdraw from life to find contentment and rest.","['https://is1-2.housingcdn.com/4f2250e8/e458152e8f83af65a95f3b88fc50cf0a/v0/_p/adarsh_pinecourt-chikkagubbi_village-bengaluru-adarsh_developers.jpg', 'https://is1-2.housingcdn.com/4f2250e8/e458152e8f83af65a95f3b88fc50cf0a/v0/large/adarsh_pinecourt-chikkagubbi_village-bengaluru-adarsh_developers.jpg', 'https://img.youtube.com/vi/dPlaDdSQfJ4/hqdefault.jpg', 'https://is1-3.housingcdn.com/012c1500/acd4ac1314548e39b9cd13219d3b6470/v0/_p.jpeg']"
88,Salarpuria Sattva Aspire,"Near United Public School,Hennur, Chikkagubbi On Hennur Main Road, North Bangalore, Bangalore",3 BHK Apartment,Ready to Move in,5.69 K/sq.ft,1904.00 sq.ft.,2 Acres,3 Buildings - 119 units,"Aug, 2013","Salarpuria Sattva Aspire is a project by Salarpuria Sattva in Bangalore. It is a Ready to Move in project. Salarpuria Sattva Aspire offers some of the most conveniently designed Apartment. Located in Chikkagubbi Village, it is a residential project. The project is spread over 2 Acres . It has 119 units. There are 3 buildings in this project. Salarpuria Sattva Aspire offers some of the most exclusive 3 BHK. As per the area plan, units are in the size of 1904.0 sq.ft.. Launched in September 2013, Salarpuria Sattva Aspire is slated for possession in Dec, 2016. The address of Salarpuria Sattva Aspire is Near United Public School,Hennur, Chikkagubbi On Hennur Main Road.Salarpuria Sattva Aspire ensures a coveted lifestyle and offers a convenient living. It offers facilities such as Gymnasium, Power Backup. If you are a sports lover, there are provisions meant for you such as Cycling & Jogging Track. Young families with kids can explore modern-arrangements for leisure and play such as Children's Play Area, nearby apart from Swimming Pool. There is 24x7 Security. Some other provisions include access to Landscaped Garden, Multipurpose Room, Staff Quarter.All major banks such as HDFC, LIC Housing Finance have approved home loans for Salarpuria Sattva Aspire. You can also avail of Pay 5% now & Move-in today, Limited-time offer.Established in 1986, Salarpuria Sattva is a renowned developer firm. Till date, Salarpuria Sattva has developed 63 projects with a focus on healthy and sustainable lifestyle.Chikkagubbi Village is well-connected to other parts of the city via an extensive road.","['https://is1-2.housingcdn.com/4f2250e8/bfcb9e6ec2f8093fb16e1fc6269513f9/v0/_p/salarpuria_sattva_aspire-hennur_main_road-bengaluru-salarpuria_sattva.jpg', 'https://is1-2.housingcdn.com/4f2250e8/bfcb9e6ec2f8093fb16e1fc6269513f9/v0/large/salarpuria_sattva_aspire-hennur_main_road-bengaluru-salarpuria_sattva.jpg', 'https://img.youtube.com/vi/wbIbO1fWVYk/hqdefault.jpg', 'https://is1-3.housingcdn.com/012c1500/9522a3668ca4bc73b463148820eee355/v0/_p.png']"
89,Arinaa Country Farms,"Seegekota, Kanakapura, Kanakpura Road-Kanakpura, Bangalore",Residential Plots,Ready to Move,599/sq.ft,5659.00 sq.ft. - 16247.00 sq.ft.,15 Acres,50 units,,"Arinaa Country Farms is a residential plot of Delight living spaces. This plot is available for sale in Kanakapura, Bangalore. This project offers plots in various sizes. The minimum plot size is 5659.0 sq. ft. and the maximum size is 16247.0 sq. ft. The address of Arinaa Country Farms is Survey Number 69, Seegekota, Kanakapura.
Arinaa Country Farms ensures a coveted lifestyle and offers a convenient living. It offers facilities such as Gymnasium.  For families with kids, there is a Children's Play Area, nearby apart from Swimming Pool. Sports enthusiasts can also make the most of the Tennis Court, Cricket Pitch.  Residents can also enjoy Internet / Wi-Fi, provisions in the project.  There is 24x7 Security.
This residential land for sale is RERA approved. For details, check RERA ID Rera Not Required.
Delight living spaces Developers is a reputed developer firm established in 2010. The firm has since then developed 4 and focuses on customer-centricity. Check out the Arinaa Country Farms brochure for more details.
Seegekota is well-connected to other parts of the city by road, which passes through the heart of this suburb. Prominent shopping malls, movie theatres, schools, and hospitals are present in the proximity of this residential project.","['https://is1-2.housingcdn.com/4f2250e8/55d26dfb3193ad78cc4d6794a863f657/v0/_p/arinaa_country_farms-kanakapura_1-bengaluru-delight_properties.jpeg', 'https://is1-2.housingcdn.com/4f2250e8/55d26dfb3193ad78cc4d6794a863f657/v0/large/arinaa_country_farms-kanakapura_1-bengaluru-delight_properties.jpeg', 'https://is1-3.housingcdn.com/012c1500/11b6e6b453dab5e5802268fb4b327246/v0/_p.jpeg', 'https://is1-3.housingcdn.com/012c1500/172f478f07fb2cdd921359fd530a99f0/v0/_p.jpeg']"
